{
  "schemaVersion": "1.0.0",
  "annotationId": "red-cap-target-source-v1",
  "characterId": "red-cap-target",
  "layoutId": "red-cap-target-generated-rig",
  "sourceCanvas": {
    "width": 1024,
    "height": 1024
  },
  "overrides": {
    "referenceScale": 0.01,
    "sourceRectOverlapPolicy": "allow"
  },
  "parts": [
    {
      "partId": "pelvis",
      "file": "assets/parts/pelvis.png",
      "sourceRect": {
        "x": 420,
        "y": 480,
        "width": 180,
        "height": 150
      },
      "trimmedRect": {
        "x": 432,
        "y": 488,
        "width": 168,
        "height": 142
      },
      "joint": {
        "x": 510,
        "y": 562.5
      },
      "visualCenter": {
        "x": 516,
        "y": 559
      },
      "overrides": {
        "rotationDegrees": 0,
        "scale": {
          "x": 1,
          "y": 1
        },
        "opacity": 1
      }
    },
    {
      "partId": "torso",
      "file": "assets/parts/torso.png",
      "sourceRect": {
        "x": 395,
        "y": 280,
        "width": 230,
        "height": 260
      },
      "trimmedRect": {
        "x": 409,
        "y": 290,
        "width": 216,
        "height": 250
      },
      "joint": {
        "x": 510,
        "y": 311.2
      },
      "visualCenter": {
        "x": 517,
        "y": 415
      },
      "overrides": {
        "rotationDegrees": 0,
        "scale": {
          "x": 1,
          "y": 1
        },
        "opacity": 1
      }
    },
    {
      "partId": "head",
      "file": "assets/parts/head.png",
      "sourceRect": {
        "x": 430,
        "y": 90,
        "width": 170,
        "height": 210
      },
      "trimmedRect": {
        "x": 438,
        "y": 96,
        "width": 162,
        "height": 204
      },
      "joint": {
        "x": 515,
        "y": 106.8
      },
      "visualCenter": {
        "x": 519,
        "y": 198
      },
      "overrides": {
        "rotationDegrees": 0,
        "scale": {
          "x": 1,
          "y": 1
        },
        "opacity": 1
      }
    },
    {
      "partId": "cap",
      "file": "assets/parts/cap.png",
      "sourceRect": {
        "x": 420,
        "y": 35,
        "width": 195,
        "height": 105
      },
      "trimmedRect": {
        "x": 425,
        "y": 39,
        "width": 190,
        "height": 101
      },
      "joint": {
        "x": 517.5,
        "y": 56
      },
      "visualCenter": {
        "x": 520,
        "y": 89.5
      },
      "overrides": {
        "parentId": "head",
        "drawOrder": 18,
        "rotationDegrees": -2,
        "scale": {
          "x": 1,
          "y": 1
        },
        "opacity": 1
      }
    },
    {
      "partId": "sunglasses",
      "file": "assets/parts/sunglasses.png",
      "sourceRect": {
        "x": 445,
        "y": 145,
        "width": 145,
        "height": 65
      },
      "trimmedRect": {
        "x": 448,
        "y": 147,
        "width": 142,
        "height": 63
      },
      "joint": {
        "x": 517.5,
        "y": 177.5
      },
      "visualCenter": {
        "x": 519,
        "y": 178.5
      },
      "overrides": {
        "parentId": "head",
        "drawOrder": 19,
        "rotationDegrees": -1,
        "scale": {
          "x": 1,
          "y": 1
        },
        "opacity": 1
      }
    },
    {
      "partId": "upper-arm-left",
      "file": "assets/parts/upper-arm-left.png",
      "sourceRect": {
        "x": 285,
        "y": 315,
        "width": 145,
        "height": 210
      },
      "trimmedRect": {
        "x": 295,
        "y": 322,
        "width": 135,
        "height": 203
      },
      "joint": {
        "x": 389.4,
        "y": 495.6
      },
      "visualCenter": {
        "x": 362.5,
        "y": 423.5
      },
      "overrides": {
        "rotationDegrees": -8,
        "scale": {
          "x": 1,
          "y": 1
        },
        "opacity": 1
      }
    },
    {
      "partId": "forearm-left",
      "file": "assets/parts/forearm-left.png",
      "sourceRect": {
        "x": 245,
        "y": 465,
        "width": 135,
        "height": 205
      },
      "trimmedRect": {
        "x": 254,
        "y": 473,
        "width": 126,
        "height": 197
      },
      "joint": {
        "x": 326,
        "y": 641.3
      },
      "visualCenter": {
        "x": 317,
        "y": 571.5
      },
      "overrides": {
        "rotationDegrees": -4,
        "scale": {
          "x": 1,
          "y": 1
        },
        "opacity": 1
      }
    },
    {
      "partId": "hand-left",
      "file": "assets/parts/hand-left.png",
      "sourceRect": {
        "x": 230,
        "y": 635,
        "width": 105,
        "height": 105
      },
      "trimmedRect": {
        "x": 236,
        "y": 640,
        "width": 99,
        "height": 100
      },
      "joint": {
        "x": 287.75,
        "y": 725.3
      },
      "visualCenter": {
        "x": 285.5,
        "y": 690
      },
      "overrides": {
        "rotationDegrees": 2,
        "scale": {
          "x": 1,
          "y": 1
        },
        "opacity": 1
      }
    },
    {
      "partId": "briefcase",
      "file": "assets/parts/briefcase.png",
      "sourceRect": {
        "x": 90,
        "y": 690,
        "width": 250,
        "height": 205
      },
      "trimmedRect": {
        "x": 102,
        "y": 700,
        "width": 238,
        "height": 195
      },
      "joint": {
        "x": 295,
        "y": 858.1
      },
      "visualCenter": {
        "x": 221,
        "y": 797.5
      },
      "overrides": {
        "parentId": "hand-left",
        "drawOrder": 1,
        "rotationDegrees": 0,
        "scale": {
          "x": 1,
          "y": 1
        },
        "opacity": 1
      }
    },
    {
      "partId": "upper-arm-right",
      "file": "assets/parts/upper-arm-right.png",
      "sourceRect": {
        "x": 600,
        "y": 315,
        "width": 145,
        "height": 210
      },
      "trimmedRect": {
        "x": 610,
        "y": 322,
        "width": 135,
        "height": 203
      },
      "joint": {
        "x": 640.6,
        "y": 495.6
      },
      "visualCenter": {
        "x": 677.5,
        "y": 423.5
      },
      "overrides": {
        "rotationDegrees": 8,
        "scale": {
          "x": 1,
          "y": 1
        },
        "opacity": 1
      }
    },
    {
      "partId": "forearm-right",
      "file": "assets/parts/forearm-right.png",
      "sourceRect": {
        "x": 650,
        "y": 465,
        "width": 135,
        "height": 205
      },
      "trimmedRect": {
        "x": 659,
        "y": 473,
        "width": 126,
        "height": 197
      },
      "joint": {
        "x": 704,
        "y": 641.3
      },
      "visualCenter": {
        "x": 722,
        "y": 571.5
      },
      "overrides": {
        "rotationDegrees": 4,
        "scale": {
          "x": 1,
          "y": 1
        },
        "opacity": 1
      }
    },
    {
      "partId": "hand-right",
      "file": "assets/parts/hand-right.png",
      "sourceRect": {
        "x": 700,
        "y": 635,
        "width": 105,
        "height": 105
      },
      "trimmedRect": {
        "x": 706,
        "y": 640,
        "width": 99,
        "height": 100
      },
      "joint": {
        "x": 747.25,
        "y": 725.3
      },
      "visualCenter": {
        "x": 755.5,
        "y": 690
      },
      "overrides": {
        "rotationDegrees": -2,
        "scale": {
          "x": 1,
          "y": 1
        },
        "opacity": 1
      }
    },
    {
      "partId": "thigh-left",
      "file": "assets/parts/thigh-left.png",
      "sourceRect": {
        "x": 375,
        "y": 600,
        "width": 125,
        "height": 220
      },
      "trimmedRect": {
        "x": 383,
        "y": 606,
        "width": 117,
        "height": 214
      },
      "joint": {
        "x": 437.5,
        "y": 793.6
      },
      "visualCenter": {
        "x": 441.5,
        "y": 713
      },
      "overrides": {
        "rotationDegrees": -2,
        "scale": {
          "x": 1,
          "y": 1
        },
        "opacity": 1
      }
    },
    {
      "partId": "shin-left",
      "file": "assets/parts/shin-left.png",
      "sourceRect": {
        "x": 365,
        "y": 770,
        "width": 120,
        "height": 205
      },
      "trimmedRect": {
        "x": 372,
        "y": 776,
        "width": 113,
        "height": 199
      },
      "joint": {
        "x": 425,
        "y": 954.5
      },
      "visualCenter": {
        "x": 428.5,
        "y": 875.5
      },
      "overrides": {
        "rotationDegrees": 1,
        "scale": {
          "x": 1,
          "y": 1
        },
        "opacity": 1
      }
    },
    {
      "partId": "foot-left",
      "file": "assets/parts/foot-left.png",
      "sourceRect": {
        "x": 340,
        "y": 940,
        "width": 160,
        "height": 75
      },
      "trimmedRect": {
        "x": 345,
        "y": 944,
        "width": 155,
        "height": 71
      },
      "joint": {
        "x": 432.8,
        "y": 994
      },
      "visualCenter": {
        "x": 422.5,
        "y": 979.5
      },
      "overrides": {
        "rotationDegrees": 0,
        "scale": {
          "x": 1,
          "y": 1
        },
        "opacity": 1
      }
    },
    {
      "partId": "thigh-right",
      "file": "assets/parts/thigh-right.png",
      "sourceRect": {
        "x": 520,
        "y": 600,
        "width": 125,
        "height": 220
      },
      "trimmedRect": {
        "x": 528,
        "y": 606,
        "width": 117,
        "height": 214
      },
      "joint": {
        "x": 582.5,
        "y": 793.6
      },
      "visualCenter": {
        "x": 586.5,
        "y": 713
      },
      "overrides": {
        "rotationDegrees": 2,
        "scale": {
          "x": 1,
          "y": 1
        },
        "opacity": 1
      }
    },
    {
      "partId": "shin-right",
      "file": "assets/parts/shin-right.png",